section,title,text,url
Sec. 48.001.,STATE POLICY,"(a) It is the policy of this state that the provision of public education is a state responsibility and that a thorough and efficient system be provided and substantially financed through state revenue sources so that each student enrolled in the public school system shall have access to programs and services that are appropriate to the student's educational needs and that are substantially equal to those available to any similar student, notwithstanding varying local economic factors.(b) The public school finance system of this state shall adhere to a standard of neutrality that provides for substantially equal access to similar revenue per student at similar tax effort, considering all state and local tax revenues of districts after acknowledging all legitimate student and district cost differences. Added by Acts 1995, 74th Leg., ch. 260, Sec. 1, eff. May 30, 1995.Transferred, redesignated and amended from Education Code, Section 42.001 by Acts 2019, 86th Leg., R.S., Ch. 943 (H.B. 3), Sec. 1.013, eff. September 1, 2019.",https://statutes.capitol.texas.gov/Docs/ED/htm/ED.48.htm?view=all#48.001.
Sec. 48.002.,PURPOSES OF FOUNDATION SCHOOL PROGRAM,"(a) The purposes of the Foundation School Program set forth in this chapter are to guarantee that each school district in the state has:(1) adequate resources to provide each eligible student a basic instructional program and facilities suitable to the student's educational needs; and(2) access to a substantially equalized program of financing in excess of basic costs for certain services, as provided by this chapter.(b) The Foundation School Program consists of:(1) two tiers that in combination provide for:(A) sufficient financing for all school districts to provide a basic program of education that is rated acceptable or higher under Section 39.054 and meets other applicable legal standards; and(B) substantially equal access to funds to provide an enriched program; and(2) a facilities component as provided by Chapter 46. Added by Acts 1995, 74th Leg., ch. 260, Sec. 1, eff. May 30, 1995. Amended by Acts 1999, 76th Leg., ch. 396, Sec. 1.09, eff. Sept. 1, 1999.Amended by: Acts 2009, 81st Leg., R.S., Ch. 895 (H.B. 3), Sec. 60, eff. June 19, 2009.Transferred, redesignated and amended from Education Code, Section 42.002 by Acts 2019, 86th Leg., R.S., Ch. 943 (H.B. 3), Sec. 1.013, eff. September 1, 2019.",https://statutes.capitol.texas.gov/Docs/ED/htm/ED.48.htm?view=all#48.002.
Sec. 48.003.,STUDENT ELIGIBILITY,"(a) A student is entitled to the benefits of the Foundation School Program if, on September 1 of the school year, the student:(1) is 5 years of age or older and under 21 years of age and:(A) has not graduated from high school; or(B) has graduated from high school but is:(i) enrolled in a school district at a campus designated as a P-TECH school under Section 29.556 or in a school district participating in a partnership under Section 29.912; and(ii) completing a course of study offered through an articulation agreement or memorandum of understanding with an institution of higher education, as defined by Section 61.003, and the district described by Subparagraph (i), as applicable, under the Pathways in Technology Early College High School (P-TECH) program under Subchapter N, Chapter 29, and the Rural Pathway Excellence Partnership (R-PEP) program under Section 29.912, regardless of whether the student is enrolled in the district providing the course of study;(2) is at least 21 years of age and under 26 years of age and has been admitted by a school district to complete the requirements for a high school diploma; or(3) is at least 18 years of age and under 50 years of age and is enrolled in an adult education program provided under the adult high school charter school program under Subchapter G, Chapter 12.(b) A student to whom Subsection (a) does not apply is entitled to the benefits of the Foundation School Program if the student is enrolled in a prekindergarten class under Section 29.153.(c) A child may be enrolled in the first grade if the child is at least six years of age at the beginning of the school year of the district or has been enrolled in the first grade or has completed kindergarten in the public schools in another state before transferring to a public school in this state.(d) Notwithstanding Subsection (a), a student younger than five years of age is entitled to the benefits of the Foundation School Program if:(1) the student performs satisfactorily on the assessment instrument administered under Section 39.023(a) to students in the third grade; and(2) the district has adopted a policy for admitting students younger than five years of age. Added by Acts 1995, 74th Leg., ch. 260, Sec. 1, eff. May 30, 1995.Amended by: Acts 2007, 80th Leg., R.S., Ch. 850 (H.B. 1137), Sec. 5, eff. June 15, 2007.Acts 2013, 83rd Leg., R.S., Ch. 478 (S.B. 1142), Sec. 2, eff. September 1, 2013.Acts 2015, 84th Leg., R.S., Ch. 142 (H.B. 4), Sec. 9, eff. May 28, 2015.Acts 2019, 86th Leg., R.S., Ch. 1060 (H.B. 1051), Sec. 7, eff. June 14, 2019. Transferred, redesignated and amended from Education Code, Section 42.003 by Acts 2019, 86th Leg., R.S., Ch. 943 (H.B. 3), Sec. 1.013, eff. September 1, 2019. Amended by: Acts 2021, 87th Leg., R.S., Ch. 195 (S.B. 1615), Sec. 20, eff. May 31, 2021.Acts 2025, 89th Leg., R.S., Ch. 918 (H.B. 120), Sec. 13, eff. September 1, 2025.Acts 2025, 89th Leg., R.S., Ch. 1065 (H.B. 2), Sec. 6.13, eff. September 1, 2025.",https://statutes.capitol.texas.gov/Docs/ED/htm/ED.48.htm?view=all#48.003.
Sec. 48.0035.,USE OF FUNDING FOR CERTAIN PURPOSES,"A school district may use funding to which the district is entitled under this chapter to:(1) provide district graduates, during the first two years after high school graduation, advising support toward the successful completion of a certificate or degree program at a public institution of higher education or a postsecondary vocational training program; and(2) educate a student who has graduated from high school but is enrolled in the district in a program through which the student may earn dual credit, including the Pathways in Technology Early College High School (P-TECH) program under Subchapter N, Chapter 29, and the Rural Pathway Excellence Partnership (R-PEP) program under Section 29.912. Added by Acts 2025, 89th Leg., R.S., Ch. 918 (H.B. 120), Sec. 14, eff. September 1, 2025.Added by Acts 2025, 89th Leg., R.S., Ch. 1065 (H.B. 2), Sec. 6.14, eff. September 1, 2025.",https://statutes.capitol.texas.gov/Docs/ED/htm/ED.48.htm?view=all#48.0035.
Sec. 48.004.,ADMINISTRATION OF THE PROGRAM,"The commissioner shall adopt rules and take action and require reports consistent with this chapter as necessary to implement and administer the Foundation School Program. Added by Acts 1995, 74th Leg., ch. 260, Sec. 1, eff. May 30, 1995.Transferred, redesignated and amended from Education Code, Section 42.004 by Acts 2019, 86th Leg., R.S., Ch. 943 (H.B. 3), Sec. 1.013, eff. September 1, 2019.",https://statutes.capitol.texas.gov/Docs/ED/htm/ED.48.htm?view=all#48.004.
Sec. 48.005.,AVERAGE DAILY ATTENDANCE,"(a) In this chapter, average daily attendance is:(1) the quotient of the sum of attendance for each day of the minimum number of days of instruction as described under Section 25.081(a) divided by the minimum number of days of instruction;(2) for a district that operates under a flexible year program under Section 29.0821, the quotient of the sum of attendance for each actual day of instruction as permitted by Section 29.0821(b)(1) divided by the number of actual days of instruction as permitted by Section 29.0821(b)(1);(3) for a district that operates under a flexible school day program under Section 29.0822, the average daily attendance as calculated by the commissioner in accordance with Sections 29.0822(d) and (d-1); or(4) for a district that operates a half-day program or a full-day program under Section 29.153(c), one-half of the average daily attendance calculated under Subdivision (1).(b) A school district that experiences a decline of two percent or more in average daily attendance shall be funded on the basis of:(1) the actual average daily attendance of the preceding school year, if the decline is the result of the closing or reduction in personnel of a military base; or(2) subject to Subsection (e), an average daily attendance not to exceed 98 percent of the actual average daily attendance of the preceding school year, if the decline is not the result of the closing or reduction in personnel of a military base.(c) The commissioner shall adjust the average daily attendance of a school district that has a significant percentage of students who are migratory children as defined by 20 U.S.C. Section 6399.(d) The commissioner may adjust the average daily attendance of a school district in which a disaster, flood, extreme weather condition, fuel curtailment, or other calamity has a significant effect on the district's attendance. In addition to providing the adjustment for the amount of instructional days during the semester in which the calamity first occurred, an adjustment under this section may only be provided based on a particular calamity for an additional amount of instructional days equivalent to one school year. The commissioner may divide the adjustment between two consecutive school years.(e) For each school year, the commissioner shall adjust the average daily attendance of school districts that are entitled to funding on the basis of an adjusted average daily attendance under Subsection (b)(2) so that:(1) all districts are funded on the basis of the same percentage of the preceding year's actual average daily attendance; and(2) the total cost to the state does not exceed the amount specifically appropriated for that year for purposes of Subsection (b)(2).(e-1) In a school year in which the occurrence of an emergency or crisis, as defined by commissioner rule, causes a statewide decrease in average daily attendance of school districts entitled to funding under this chapter or, for an emergency or crisis occurring only within a specific region of this state, causes a regional decrease in the average daily attendance of school districts located in the affected region, the commissioner shall modify or waive requirements applicable to the affected districts under this section and adopt appropriate safeguards as necessary to ensure the continued support and maintenance of an efficient system of public free schools and the continued delivery of high-quality instruction under that system.(f) An open-enrollment charter school is not entitled to funding based on an adjustment under Subsection (b)(2).(g) If a student may receive course credit toward the student's high school academic requirements and toward the student's higher education academic requirements for a single course, including a course provided under Section 28.009 by a public institution of higher education, the time during which the student attends the course shall be counted as part of the minimum number of instructional hours required for a student to be considered a full-time student in average daily attendance for purposes of this section.(g-1) The commissioner shall adopt rules to calculate average daily attendance for students participating in a blended learning program in which classroom instruction is supplemented with applied workforce learning opportunities, including participation of students in internships, externships, and apprenticeships.(h) Subject to rules adopted by the commissioner under Section 48.007(b), time that a student participates in an off-campus instructional program approved under Section 48.007(a) shall be counted as part of the minimum number of instructional hours required for a student to be considered a full-time student in average daily attendance for purposes of this section.(i) A district or a charter school operating under Chapter 12 that operates a prekindergarten program is eligible to receive one-half of average daily attendance under Subsection (a) if the district's or charter school's prekindergarten program provides at least 32,400 minutes of instructional time to students.(j) A district or charter school is eligible to earn full average daily attendance under Subsection (a) if the district or school provides at least 43,200 minutes of instructional time to students enrolled in:(1) a dropout recovery school or program operating under Section 12.1141(c) or Section 39.0548;(2) an alternative education program operating under Section 37.008;(3) a school program located at a day treatment facility, residential treatment facility, psychiatric hospital, or medical hospital;(4) a school program offered at a correctional facility; or(5) a school operating under Subchapter G, Chapter 12.(k) A charter school operating under a charter granted under Chapter 12 before January 1, 2015, is eligible to earn full average daily attendance under Subsection (a), as that subsection existed immediately before January 1, 2015, for:(1) all campuses of the charter school operating before January 1, 2015; and(2) any campus or site expansion approved on or after January 1, 2015, provided that the charter school received an academic accountability performance rating of C or higher, and the campus or site expansion is approved by the commissioner.(l) A school district campus or charter school described by Subsection (j) may operate more than one program and be eligible for full average daily attendance for each program if the programs operated by the district campus or charter school satisfy all applicable state and federal requirements.(m) The commissioner shall adopt rules necessary to implement this section, including rules that:(1) establish the minimum amount of instructional time per day that allows a school district or charter school to be eligible for full average daily attendance, which may differ based on the instructional program offered by the district or charter school;(2) establish the requirements necessary for a school district or charter school to be eligible for one-half of average daily attendance, which may differ based on the instructional program offered by the district or charter school;(3) proportionally reduce the average daily attendance for a school district if any campus or instructional program in the district provides fewer than the required minimum minutes of instruction to students; and(4) allow a grade or course repeated under Section 28.02124 to qualify for average daily attendance even if the student previously passed or earned credit for the grade or course, if the grade or course would otherwise be eligible.(n) To assist school districts in implementing this section as amended by H.B. 2442, Acts of the 85th Legislature, Regular Session, 2017, the commissioner may waive a requirement of this section or adopt rules to implement this section. Added by Acts 1995, 74th Leg., ch. 260, Sec. 1, eff. May 30, 1995. Amended by Acts 1997, 75th Leg., ch. 1071, Sec. 12, eff. Sept. 1, 1997; Acts 2001, 77th Leg., ch. 924, Sec. 1, eff. Sept. 1, 2001; Acts 2001, 77th Leg., ch. 1156, Sec. 3, eff. Sept. 1, 2001; Acts 2003, 78th Leg., ch. 220, Sec. 2, eff. Sept. 1, 2003; Acts 2003, 78th Leg., ch. 824, Sec. 3, eff. June 20, 2003.Amended by: Acts 2005, 79th Leg., Ch. 1339 (S.B. 151), Sec. 4, eff. June 18, 2005.Acts 2006, 79th Leg., 3rd C.S., Ch. 5 (H.B. 1), Sec. 5.07, eff. May 31, 2006.Acts 2009, 81st Leg., R.S., Ch. 1328 (H.B. 3646), Sec. 47, eff. September 1, 2009.Acts 2009, 81st Leg., R.S., Ch. 1328 (H.B. 3646), Sec. 48, eff. September 1, 2011.Acts 2011, 82nd Leg., R.S., Ch. 1104 (S.B. 1619), Sec. 2, eff. June 17, 2011.Acts 2015, 84th Leg., R.S., Ch. 791 (H.B. 2660), Sec. 2, eff. June 17, 2015.Acts 2015, 84th Leg., R.S., Ch. 797 (H.B. 2812), Sec. 1, eff. June 17, 2015.Acts 2017, 85th Leg., R.S., Ch. 851 (H.B. 2442), Sec. 8, eff. June 15, 2017.Acts 2017, 85th Leg., R.S., Ch. 970 (S.B. 2084), Sec. 1, eff. June 15, 2017.Transferred, redesignated and amended from Education Code, Section 42.005 by Acts 2019, 86th Leg., R.S., Ch. 943 (H.B. 3), Sec. 1.013, eff. September 1, 2019.Amended by: Acts 2021, 87th Leg., R.S., Ch. 195 (S.B. 1615), Sec. 21, eff. May 31, 2021.Acts 2021, 87th Leg., R.S., Ch. 806 (H.B. 1525), Sec. 21, eff. September 1, 2021.Acts 2021, 87th Leg., R.S., Ch. 887 (S.B. 1697), Sec. 6, eff. June 16, 2021.Acts 2021, 87th Leg., 2nd C.S., Ch. 5 (S.B. 15), Sec. 6, eff. September 9, 2021.Acts 2025, 89th Leg., R.S., Ch. 5 (S.B. 569), Sec. 10, eff. May 6, 2025.",https://statutes.capitol.texas.gov/Docs/ED/htm/ED.48.htm?view=all#48.005.
Sec. 48.0051.,INCENTIVE FOR ADDITIONAL INSTRUCTIONAL DAYS,"(a) The commissioner shall adjust the average daily attendance of a school district or open-enrollment charter school under Section 48.005 in the manner provided by Subsection (b) if the district or school:(1) provides the minimum number of minutes of operational and instructional time required under Section 25.081 and commissioner rules adopted under that section over at least 175 days of instruction; and(2) offers an additional 30 days of half-day instruction for students enrolled in prekindergarten through eighth grade.(a-1) Repealed by Acts 2021, 87th Leg., R.S., Ch. 806 (H.B. 1525), Sec. 48(a)(4), eff. September 1, 2021.(b) Subject to Subsection (b-1), for a school district or open-enrollment charter school described by Subsection (a), the commissioner shall increase the average daily attendance of the district or school under Section 48.005 by the amount that results from the quotient of the sum of attendance by students described by Subsection (a)(2) for each of the 30 additional instructional days of half-day instruction that are provided divided by 175.(b-1) For a school district or open-enrollment charter school described by Subsection (a) that provides at least 200 full days of instruction to students described by Subsection (a)(2), the commissioner shall increase the amount computed for the district or school under Subsection (b) by 50 percent.(c) The commissioner may provide the incentive under this section to a school district or open-enrollment charter school that intended, but due to circumstances beyond the district's or school's control, including the occurrence of a natural disaster affecting the district or school, was unable to meet the requirement for instruction under Section 25.081 plus an additional 30 days of half-day instruction. The commissioner may proportionately reduce the incentive provided to a district or school described by this subsection.(d) This section does not prohibit a school district from providing the minimum number of minutes of operational and instructional time required under Section 25.081 and commissioner rules adopted under that section over fewer than 175 days of instruction.(e) The agency shall assist school districts and open-enrollment charter schools in qualifying for the incentive under this section.(f) A school district or open-enrollment charter school may use funding attributable to the incentive provided under this section to pay costs associated with providing academic instruction in a voluntary summer program for students enrolled in the district or school.(g) The commissioner shall adopt rules necessary for the implementation of this section. Added by Acts 2019, 86th Leg., R.S., Ch. 943 (H.B. 3), Sec. 1.014, eff. September 1, 2020.Amended by: Acts 2021, 87th Leg., R.S., Ch. 806 (H.B. 1525), Sec. 48(a)(4), eff. September 1, 2021.Acts 2025, 89th Leg., R.S., Ch. 1065 (H.B. 2), Sec. 5.24, eff. September 1, 2025.",https://statutes.capitol.texas.gov/Docs/ED/htm/ED.48.htm?view=all#48.0051.
Sec. 48.0052.,INCENTIVE FOR ADDITIONAL INSTRUCTIONAL DAYS FOR READING INTERVENTIONS,"(a) The commissioner shall adjust the average daily attendance of a school district or open-enrollment charter school under Section 48.005 in the manner provided by Subsection (b) if the district or school:(1) does not qualify for funding under Section 48.0051;(2) provides the minimum number of minutes of operational and instructional time required under Section 25.081 and commissioner rules adopted under that section; and(3) offers up to an additional 30 days of half-day instruction consisting of reading interventions described by Section 28.0064 for students who are required to be provided reading interventions under that section.(b) For a school district or open-enrollment charter school described by Subsection (a), the commissioner shall increase the average daily attendance of the district or school under Section 48.005 by 50 percent of the amount that results from the quotient of the sum of attendance by students described by Subsection (a)(3) for each of the additional instructional days of half-day instruction that are provided divided by 175.(c) The agency shall assist school districts and open-enrollment charter schools in qualifying for the incentive under this section.(d) The commissioner shall adopt rules necessary for the implementation of this section. Added by Acts 2025, 89th Leg., R.S., Ch. 1065 (H.B. 2), Sec. 5.25, eff. September 1, 2025.",https://statutes.capitol.texas.gov/Docs/ED/htm/ED.48.htm?view=all#48.0052.
Sec. 48.006.,AVERAGE DAILY ATTENDANCE FOR DISTRICTS IN DISASTER AREA,"(a) The commissioner may adjust the average daily attendance of a school district all or part of which is located in an area declared a disaster area by the governor under Chapter 418, Government Code, if the district experiences a decline in average daily attendance that is reasonably attributable to the impact of the disaster.(b) The adjustment must be sufficient to ensure that the district receives funding comparable to the funding that the district would have received if the decline in average daily attendance reasonably attributable to the impact of the disaster had not occurred.(c) The commissioner may make the adjustment under this section for the two-year period following the date of the governor's initial proclamation or executive order declaring the state of disaster.(d) Section 48.005(b)(2) does not apply to a district that receives an adjustment under this section.(e) A district that receives an adjustment under this section may not receive any additional adjustment under Section 48.005(d) for the decline in average daily attendance on which the adjustment under this section is based.(f) For purposes of this title, a district's adjusted average daily attendance under this section is considered to be the district's average daily attendance as determined under Section 48.005. Added by Acts 2009, 81st Leg., R.S., Ch. 1006 (H.B. 4102), Sec. 4, eff. June 19, 2009.Transferred, redesignated and amended from Education Code, Section 42.0051 by Acts 2019, 86th Leg., R.S., Ch. 943 (H.B. 3), Sec. 1.015, eff. September 1, 2019.",https://statutes.capitol.texas.gov/Docs/ED/htm/ED.48.htm?view=all#48.006.
Sec. 48.007.,OFF-CAMPUS PROGRAMS APPROVED FOR PURPOSES OF AVERAGE DAILY ATTENDANCE,"(a) The commissioner may, based on criteria developed by the commissioner, approve instructional programs provided off campus by an entity other than a school district or open-enrollment charter school as a program in which participation by a student of a district or charter school may be counted for purposes of determining average daily attendance in accordance with Section 48.005(h).(b) The commissioner shall adopt by rule verification and reporting procedures concerning time spent by students participating in instructional programs approved under Subsection (a). Added by Acts 2015, 84th Leg., R.S., Ch. 797 (H.B. 2812), Sec. 2, eff. June 17, 2015.Transferred, redesignated and amended from Education Code, Section 42.0052 by Acts 2019, 86th Leg., R.S., Ch. 943 (H.B. 3), Sec. 1.015, eff. September 1, 2019.",https://statutes.capitol.texas.gov/Docs/ED/htm/ED.48.htm?view=all#48.007.
