section,title,text,url
Sec. 48.102.,SPECIAL EDUCATION,"(a) For each student in average daily attendance in a special education program under Subchapter A, Chapter 29, in a mainstream instructional arrangement, a school district is entitled to an annual allotment equal to the basic allotment, or, if applicable, the sum of the basic allotment and the allotment under Section 48.101 to which the district is entitled, multiplied by 1.15. For each full-time equivalent student in average daily attendance in a special education program under Subchapter A, Chapter 29, in an instructional arrangement other than a mainstream instructional arrangement, a district is entitled to an annual allotment equal to the basic allotment, or, if applicable, the sum of the basic allotment and the allotment under Section 48.101 to which the district is entitled, multiplied by a weight determined according to instructional arrangement as follows:Homebound5.0Hospital class3.0Speech therapy5.0Resource room3.0Self-contained, mild and moderate,regular campus3.0Self-contained, severe, regular campus3.0Off home campus2.7Nonpublic day school1.7Vocational adjustment class2.3(b) A special instructional arrangement for students with disabilities residing in care and treatment facilities, other than state schools, whose parents or guardians do not reside in the district providing education services shall be established by commissioner rule. The funding weight for this arrangement shall be 4.0 for those students who receive their education service on a local school district campus. A special instructional arrangement for students with disabilities residing in state schools shall be established by commissioner rule with a funding weight of 2.8.(c) For funding purposes, the number of contact hours credited per day for each student in the off home campus instructional arrangement may not exceed the contact hours credited per day for the multidistrict class instructional arrangement in the 1992-1993 school year.(d) For funding purposes the contact hours credited per day for each student in the resource room; self-contained, mild and moderate; and self-contained, severe, instructional arrangements may not exceed the average of the statewide total contact hours credited per day for those three instructional arrangements in the 1992-1993 school year.(e) The commissioner by rule shall prescribe the qualifications an instructional arrangement must meet in order to be funded as a particular instructional arrangement under this section. In prescribing the qualifications that a mainstream instructional arrangement must meet, the commissioner shall establish requirements that students with disabilities and their teachers receive the direct, indirect, and support services that are necessary to enrich the regular classroom and enable student success.(f) In this section, ""full-time equivalent student"" means 30 hours of contact a week between a special education student and special education program personnel.(g) The commissioner shall adopt rules and procedures governing contracts for residential placement of special education students. The legislature shall provide by appropriation for the state's share of the costs of those placements.(h) At least 55 percent of the funds allocated under this section must be used in the special education program under Subchapter A, Chapter 29.(i) The agency shall encourage the placement of students in special education programs, including students in residential instructional arrangements, in the least restrictive environment appropriate for their educational needs.(j) A school district that provides an extended year program required by federal law for special education students who may regress is entitled to receive funds in an amount equal to 75 percent, or a lesser percentage determined by the commissioner, of the basic allotment, or, if applicable, the sum of the basic allotment and the allotment under Section 48.101 to which the district is entitled for each full-time equivalent student in average daily attendance, multiplied by the amount designated for the student's instructional arrangement under this section, for each day the program is provided divided by the number of days in the minimum school year. The total amount of state funding for extended year services under this section may not exceed $10 million per year. A school district may use funds received under this section only in providing an extended year program.(k) From the total amount of funds appropriated for special education under this section, the commissioner shall withhold an amount specified in the General Appropriations Act, and distribute that amount to school districts for programs under Section 29.014. The program established under that section is required only in school districts in which the program is financed by funds distributed under this subsection and any other funds available for the program. After deducting the amount withheld under this subsection from the total amount appropriated for special education, the commissioner shall reduce each district's allotment proportionately and shall allocate funds to each district accordingly. Added by Acts 1995, 74th Leg., ch. 260, Sec. 1, eff. May 30, 1995. Amended by Acts 2003, 78th Leg., ch. 545, Sec. 1, eff. Sept. 1, 2003.Amended by: Acts 2011, 82nd Leg., R.S., Ch. 494 (H.B. 1130), Sec. 1, eff. September 1, 2011.Transferred, redesignated and amended from Education Code, Section 42.151 by Acts 2019, 86th Leg., R.S., Ch. 943 (H.B. 3), Sec. 1.025, eff. September 1, 2019.Amended by: Acts 2025, 89th Leg., R.S., Ch. 1065 (H.B. 2), Sec. 4.54, eff. September 1, 2026. Text of section effective on September 01, 2026",https://statutes.capitol.texas.gov/Docs/ED/htm/ED.48.htm?view=all#48.102.
Sec. 48.102.,SPECIAL EDUCATION,"(a) For each student in average daily attendance in a special education program under Subchapter A, Chapter 29, a school district is entitled to an annual allotment equal to the basic allotment, or, if applicable, the sum of the basic allotment and the allotment under Section 48.101 to which the district is entitled, multiplied by a weight in an amount set by the legislature in the General Appropriations Act for the highest tier of intensity of service for which the student qualifies.(a-1) Notwithstanding Subsection (a), for the 2026-2027 school year, the amount of an allotment under this section shall be determined in accordance with Section 48.1022. This subsection expires September 1, 2027. (b) The commissioner by rule shall define eight tiers of intensity of service for use in determining funding under this section. The commissioner must include one tier specifically addressing students receiving special education services in residential placement and one tier for students receiving only speech therapy.(c) In defining the tiers of intensity of service under Subsection (b), the commissioner shall consider:(1) the type, frequency, and nature of services provided to a student;(2) the required certifications, licensures, or other qualifications for personnel serving the student;(3) any identified or curriculum-required provider-to-student ratios for the student to receive the appropriate services; and(4) any equipment or technology required for the services.(d) At least 55 percent of the funds allocated under this section must be used in the special education program under Subchapter A, Chapter 29.(e) The agency shall ensure the placement of students in special education programs, including students in residential placement, in the least restrictive environment appropriate for their educational needs.(f) A school district that provides an extended year program required by federal law for special education students who may regress is entitled to receive funds in an amount equal to the basic allotment, or, if applicable, the sum of the basic allotment and the allotment under Section 48.101 to which the district is entitled for each student in average daily attendance, multiplied by the amount designated for the highest tier of intensity of service for which the student qualifies under this section, for each day the program is provided divided by the number of days in the minimum school year. A school district may use funds received under this section only in providing an extended year program.(g) From the total amount of funds appropriated for special education under this section, the commissioner shall withhold an amount specified in the General Appropriations Act, and distribute that amount to school districts for programs under Section 29.014. The program established under that section is required only in school districts in which the program is financed by funds distributed under this subsection and any other funds available for the program. After deducting the amount withheld under this subsection from the total amount appropriated for special education, the commissioner shall reduce each district's allotment proportionately and shall allocate funds to each district accordingly.(h) Not later than December 1 of each even-numbered year, the commissioner shall submit to the Legislative Budget Board, for purposes of the allotment under this section, proposed weights for the tiers of intensity of service for the next state fiscal biennium. Added by Acts 1995, 74th Leg., ch. 260, Sec. 1, eff. May 30, 1995. Amended by Acts 2003, 78th Leg., ch. 545, Sec. 1, eff. Sept. 1, 2003.Amended by: Acts 2011, 82nd Leg., R.S., Ch. 494 (H.B. 1130), Sec. 1, eff. September 1, 2011.Transferred, redesignated and amended from Education Code, Section 42.151 by Acts 2019, 86th Leg., R.S., Ch. 943 (H.B. 3), Sec. 1.025, eff. September 1, 2019.Amended by: Acts 2025, 89th Leg., R.S., Ch. 1065 (H.B. 2), Sec. 4.54, eff. September 1, 2026.Acts 2025, 89th Leg., R.S., Ch. 1137 (S.B. 568), Sec. 55, eff. September 1, 2026. Text of section effective on September 01, 2026",https://statutes.capitol.texas.gov/Docs/ED/htm/ED.48.htm?view=all#48.102.
Sec. 48.1021.,SPECIAL EDUCATION SERVICE GROUP ALLOTMENT,"(a) For each student in a special education program under Subchapter A, Chapter 29, a school district is entitled to an allotment in an amount set by the legislature in the General Appropriations Act for the service group for which the student receives services.(a-1) Notwithstanding Subsection (a), for the 2026-2027 school year, the amount of an allotment under this section shall be determined in accordance with Section 48.1022. This subsection expires September 1, 2027.(b) The commissioner by rule shall establish at least four service groups for use in determining funding under this section. In establishing the groups, the commissioner must consider:(1) the type, frequency, and nature of services provided to a student;(2) the required certifications, licensures, or other qualifications for personnel serving the student;(3) any identified or curriculum-required provider-to-student ratios for the student to receive the appropriate services; and(4) any equipment or technology required for the services.(c) At least 55 percent of the funds allocated under this section must be used for a special education program under Subchapter A, Chapter 29.(d) Not later than December 1 of each even-numbered year, the commissioner shall submit to the Legislative Budget Board, for purposes of the allotment under this section, proposed amounts of funding for the service groups for the next state fiscal biennium. Added by Acts 2025, 89th Leg., R.S., Ch. 1065 (H.B. 2), Sec. 4.55, eff. September 1, 2026.Added by Acts 2025, 89th Leg., R.S., Ch. 1137 (S.B. 568), Sec. 56, eff. September 1, 2026. For expiration of this section, see Subsection (e).Text of section effective on September 01, 2026",https://statutes.capitol.texas.gov/Docs/ED/htm/ED.48.htm?view=all#48.1021.
Sec. 48.1022.,SPECIAL EDUCATION TRANSITION FUNDING,"(a) For the 2026-2027 school year, the commissioner may adjust weights or amounts provided under Section 48.102 or 48.1021 as necessary to ensure compliance with requirements regarding maintenance of state financial support under 20 U.S.C. Section 1412(a)(18) and maintenance of local financial support under applicable federal law.(b) For the 2026-2027 school year, the commissioner shall determine the formulas through which school districts receive funding under Sections 48.102 and 48.1021. In determining the formulas, the commissioner shall ensure the estimated statewide amount provided by the sum of the allotments under Sections 48.102 and 48.1021 for the 2026-2027 school year is approximately $250 million greater than the amount that would have been provided under the allotment under Section 48.102, as that section existed on September 1, 2025, for that school year, calculating both amounts using the basic allotment in effect for the 2026-2027 school year.(c) Each school district and open-enrollment charter school shall report to the agency information necessary to implement this section.(d) The agency shall provide technical assistance to school districts and open-enrollment charter schools to ensure a successful transition in funding formulas for special education.(e) This section expires September 1, 2028. Added by Acts 2025, 89th Leg., R.S., Ch. 1065 (H.B. 2), Sec. 4.55, eff. September 1, 2026.Added by Acts 2025, 89th Leg., R.S., Ch. 1137 (S.B. 568), Sec. 56, eff. September 1, 2026.",https://statutes.capitol.texas.gov/Docs/ED/htm/ED.48.htm?view=all#48.1022.
Sec. 48.103.,ALLOTMENT FOR STUDENT WITH DYSLEXIA OR RELATED DISORDER,"(a) Subject to Subsection (b), for each student that a school district serves who has been identified as having dyslexia or a related disorder, the district is entitled to an annual allotment equal to the basic allotment multiplied by 0.1 or a greater amount provided by appropriation.Text of subsection effective until September 01, 2026(b) A school district is entitled to an allotment under Subsection (a) only for a student who:(1) is receiving services for dyslexia or a related disorder in accordance with:(A) an individualized education program developed for the student under Section 29.005; or(B) a plan developed for the student under Section 504, Rehabilitation Act of 1973 (29 U.S.C. Section 794);(2) is receiving instruction that:(A) meets applicable dyslexia program criteria established by the State Board of Education; and(B) is provided by a person with specific training in providing that instruction; or(3) is permitted, on the basis of having dyslexia or a related disorder, to use modifications in the classroom or accommodations in the administration of assessment instruments under Section 39.023.Text of subsection effective on September 01, 2026(b) A school district is entitled to an allotment under Subsection (a) only for a student who:(1) is receiving:(A) instruction, services, or accommodations for dyslexia or a related disorder in accordance with an individualized education program developed for the student under Section 29.005; or(B) accommodations for dyslexia or a related disorder in accordance with a plan developed for the student under Section 504, Rehabilitation Act of 1973 (29 U.S.C. Section 794); or(2) is permitted, on the basis of having dyslexia or a related disorder, to use modifications in the classroom or accommodations in the administration of assessment instruments under Section 39.023 without a program or plan described by Subdivision (1).Text of subsection effective until September 01, 2026(c) A school district may receive funding for a student under this section and Section 48.102 if the student satisfies the requirements of both sections.Text of subsection effective on September 01, 2026(c) A school district may receive funding for a student under each provision of this section, Section 48.102, and Section 48.1021 for which the student qualifies.Text of subsection effective until September 01, 2026(d) A school district may use an amount not to exceed 20 percent of the allotment provided for a qualifying student under this section to contract with a private provider to provide supplemental academic services to the student that are recommended under the student's program or plan described by Subsection (b). A student may not be excused from school to receive supplemental academic services provided under this subsection.Text of subsection effective on September 01, 2026(d) A school district may use the allotment provided for a qualifying student under this section to contract with a private provider to provide supplemental academic services to the student that are recommended under the student's program or plan described by Subsection (b). A student may not be excused from school to receive supplemental academic services provided under this subsection. Added by Acts 2019, 86th Leg., R.S., Ch. 943 (H.B. 3), Sec. 1.027, eff. September 1, 2019.Amended by: Acts 2025, 89th Leg., R.S., Ch. 1065 (H.B. 2), Sec. 4.56, eff. September 1, 2026.Acts 2025, 89th Leg., R.S., Ch. 1137 (S.B. 568), Sec. 57, eff. September 1, 2026.",https://statutes.capitol.texas.gov/Docs/ED/htm/ED.48.htm?view=all#48.103.
Sec. 48.104.,COMPENSATORY EDUCATION ALLOTMENT,"(a) For each student who does not have a disability and resides in a residential placement facility in a district in which the student's parent or legal guardian does not reside, a district is entitled to an annual allotment equal to the basic allotment multiplied by 0.2 or, if the student is educationally disadvantaged, 0.275. For each full-time equivalent student who is in a remedial and support program under Section 29.081 because the student is pregnant, a district is entitled to an annual allotment equal to the basic allotment multiplied by 2.41.(b) For each student who is educationally disadvantaged and resides in an economically disadvantaged census block group as determined by the commissioner under Subsection (c), a district is entitled to an annual allotment equal to the basic allotment multiplied by the weight assigned to the student's census block group under Subsection (d).(c) For purposes of the allotment under Subsection (b), the commissioner shall establish an index for economically disadvantaged census block groups in the state that provides criteria for determining which census block groups are economically disadvantaged and categorizes economically disadvantaged census block groups in five tiers according to relative severity of economic disadvantage. In determining the severity of economic disadvantage in a census block group, the commissioner shall consider:(1) the median household income;(2) the average educational attainment of the population;(3) the percentage of single-parent households;(4) the rate of homeownership; and(5) other economic criteria the commissioner determines likely to disadvantage a student's preparedness and ability to learn.(d) The weights assigned to the five tiers of the index established under Subsection (c) are, from least to most severe economic disadvantage, 0.225, 0.2375, 0.25, 0.2625, and 0.275.(e) If insufficient data is available for any school year to evaluate the level of economic disadvantage in a census block group, a school district is entitled to an annual allotment equal to the basic allotment multiplied by 0.225 for each student who is educationally disadvantaged and resides in that census block group.(e-1) For each student who is a homeless child or youth as defined by 42 U.S.C. Section 11434a, a school district is entitled to an annual allotment equal to the basic allotment multiplied by the highest weight provided under Subsection (d).(f) A student receiving a full-time virtual education provided through a full-time virtual campus under Chapter 30B shall be included in determining the number of students who are educationally disadvantaged and reside in an economically disadvantaged census block group under Subsection (b) or (e), as applicable.(g) Not later than March 1 of each year, the commissioner shall:(1) review and, if necessary, update the index established under Subsection (c) to be used for the following school year, based on the most recent estimates published by the United States Census Bureau; and(2) notify each school district of any changes to the index.(h) The state demographer, the Department of Agriculture, and any other state agency with relevant information shall assist the commissioner in performing the commissioner's duties under this section.(i) On a schedule determined by the commissioner, each school district shall report to the agency the census block group in which each student enrolled in the district who is educationally disadvantaged resides. The agency shall provide to school districts a resource for use in determining the census block group in which a student resides.(j) The commissioner shall adopt rules for the method of determining the number of students who qualify for an allotment under this section at a campus that participates in the Community Eligibility Provision administered by the United States Department of Agriculture, as provided by the Healthy, Hunger-Free Kids Act of 2010 (Pub. L. No. 111-296).(j-1) Repealed by Acts 2025, 89th Leg., R.S., Ch. 1065 (H.B. 2), Sec. 7.24(1), eff. September 1, 2025.(k) Repealed by Acts 2025, 89th Leg., R.S., Ch. 1065 (H.B. 2), Sec. 7.24(1), eff. September 1, 2025.(l) Repealed by Acts 2025, 89th Leg., R.S., Ch. 1065 (H.B. 2), Sec. 7.24(1), eff. September 1, 2025.(m) Repealed by Acts 2025, 89th Leg., R.S., Ch. 1065 (H.B. 2), Sec. 7.24(1), eff. September 1, 2025.(n) Repealed by Acts 2025, 89th Leg., R.S., Ch. 1065 (H.B. 2), Sec. 7.24(1), eff. September 1, 2025.(o) Repealed by Acts 2025, 89th Leg., R.S., Ch. 1065 (H.B. 2), Sec. 7.24(1), eff. September 1, 2025. Added by Acts 1995, 74th Leg., ch. 260, Sec. 1, eff. May 30, 1995. Amended by Acts 1997, 75th Leg., ch. 1071, Sec. 16, eff. Sept. 1, 1997; Acts 1999, 76th Leg., ch. 396, Sec. 1.13, eff. Sept. 1, 1999; Acts 2001, 77th Leg., ch. 725, Sec. 11, eff. June 13, 2001; Acts 2001, 77th Leg., ch. 1156, Sec. 4, 12, eff; Sept. 1, 2001; Acts 2003, 78th Leg., ch. 201, Sec. 30, eff. Sept. 1, 2003; Acts 2003, 78th Leg., ch. 253, Sec. 1, eff. sept. 1, 2003; Acts 2003, 78th Leg., ch. 783, Sec. 2, eff. Sept. 1, 2003; Acts 2003, 78th Leg., ch. 785, Sec. 57, eff. Sept. 1, 2003; Acts 2003, 78th Leg., ch. 903, Sec. 3, eff. Sept. 1, 2003; Acts 2003, 78th Leg., ch. 1276, Sec. 6.009, eff. Sept. 1, 2003.Amended by: Acts 2005, 79th Leg., Ch. 728 (H.B. 2018), Sec. 23.001(17), eff. September 1, 2005.Acts 2007, 80th Leg., R.S., Ch. 1204 (H.B. 1609), Sec. 3, eff. September 1, 2007.Acts 2009, 81st Leg., R.S., Ch. 1328 (H.B. 3646), Sec. 52, eff. September 1, 2009.Acts 2009, 81st Leg., R.S., Ch. 1328 (H.B. 3646), Sec. 53, eff. September 1, 2009.Acts 2009, 81st Leg., R.S., Ch. 1328 (H.B. 3646), Sec. 105(a)(6), eff. September 1, 2009.Acts 2011, 82nd Leg., 1st C.S., Ch. 4 (S.B. 1), Sec. 57.12, eff. September 28, 2011.Acts 2015, 84th Leg., R.S., Ch. 1250 (H.B. 1305), Sec. 2, eff. June 20, 2015.Transferred, redesignated and amended from Education Code, Section 42.152 by Acts 2019, 86th Leg., R.S., Ch. 943 (H.B. 3), Sec. 1.028, eff. September 1, 2019.Amended by: Acts 2021, 87th Leg., R.S., Ch. 806 (H.B. 1525), Sec. 24, eff. September 1, 2021.Acts 2025, 89th Leg., R.S., Ch. 5 (S.B. 569), Sec. 12, eff. May 6, 2025.Acts 2025, 89th Leg., R.S., Ch. 1065 (H.B. 2), Sec. 7.24(1), eff. September 1, 2025.",https://statutes.capitol.texas.gov/Docs/ED/htm/ED.48.htm?view=all#48.104.
Sec. 48.1041.,COMPENSATORY EDUCATION ALLOTMENT ADVISORY COMMITTEE,"(a) The commissioner shall establish an advisory committee to advise the agency in adopting rules for the compensatory education allotment under Section 48.104, including:(1) rules establishing the economic criteria described by Section 48.104(c)(5);(2) rules detailing the method to count students who qualify for the allotment in:(A) a dropout recovery school or program; or(B) a residential treatment facility;(3) methods for properly counting students who are homeless within the meaning of ""homeless children and youths"" under 42 U.S.C. Section 11434a; and(4) rules to determine the appropriate weight by which to adjust the basic allotment in determining the compensatory allotment for students described by Subdivision (3).(b) The advisory committee consists of members appointed by the commissioner, including:(1) school district superintendents and chief financial officers;(2) classroom teachers;(3) representatives of school districts located in an area other than an urban area, as designated by the United States Census Bureau;(4) at least one representative of an open-enrollment charter school;(5) demographers;(6) experts on census data;(7) public school finance experts; and(8) appropriate employees of the agency.(c) Members of the advisory committee serve at the pleasure of the commissioner.(d) A member of the advisory committee is not entitled to receive compensation for service on the committee or reimbursement for expenses incurred in performing official duties as a member of the committee.(e) Chapter 2110, Government Code, does not apply to the advisory committee.(f) Not less than once every two years, the advisory committee shall review census and student data and provide recommendations to the agency regarding any suggested changes to the rules adopted for the compensatory education allotment under Section 48.104. Added by Acts 2019, 86th Leg., R.S., Ch. 943 (H.B. 3), Sec. 1.029, eff. June 12, 2019.",https://statutes.capitol.texas.gov/Docs/ED/htm/ED.48.htm?view=all#48.1041.
