section,title,text,url
Sec. 48.155.,COLLEGE PREPARATION AND CAREER READINESS ASSESSMENT REIMBURSEMENT,"A school district is entitled to reimbursement for the amount of fees paid by the district for the administration of an assessment instrument under Section 39.0261(a)(3). Added by Acts 2019, 86th Leg., R.S., Ch. 943 (H.B. 3), Sec. 1.036, eff. September 1, 2019.Amended by: Acts 2025, 89th Leg., R.S., Ch. 918 (H.B. 120), Sec. 20, eff. September 1, 2025.Acts 2025, 89th Leg., R.S., Ch. 1065 (H.B. 2), Sec. 6.20, eff. September 1, 2025.",https://statutes.capitol.texas.gov/Docs/ED/htm/ED.48.htm?view=all#48.155.
Sec. 48.156.,CERTIFICATION EXAMINATION REIMBURSEMENT,"(a) A school district is entitled to reimbursement for the amount of a subsidy paid by the district for not more than two certification examinations per student under Section 29.190(a), including costs paid for associated fingerprinting or criminal history record information review, as provided by Section 29.190(c).(b) Notwithstanding Subsection (a), the total amount that may be used for reimbursement under that subsection for a school year may not exceed $20 million, of which not more than $500,000 may be used to reimburse the costs of fingerprinting or criminal history record information review. If the total amount to which school districts are entitled under Subsection (a) exceeds the amount permitted under this subsection, the commissioner shall proportionately reduce each school district's entitlement under this section. Added by Acts 2019, 86th Leg., R.S., Ch. 943 (H.B. 3), Sec. 1.036, eff. September 1, 2019.Amended by: Acts 2025, 89th Leg., R.S., Ch. 918 (H.B. 120), Sec. 21, eff. September 1, 2025.Acts 2025, 89th Leg., R.S., Ch. 1065 (H.B. 2), Sec. 6.21, eff. September 1, 2025. Text of section effective on September 01, 2026",https://statutes.capitol.texas.gov/Docs/ED/htm/ED.48.htm?view=all#48.156.
Sec. 48.157.,PREPARING AND RETAINING EDUCATORS THROUGH PARTNERSHIP PROGRAM ALLOTMENT,"(a) In this section, ""teacher candidate"" has the meaning assigned by Section 21.901.(b) Subject to Subsections (f) and (g), a school district is entitled to an annual allotment equal to each of the following applicable amounts:(1) for each teacher candidate completing preservice practice hours at the district under Section 21.903, the sum of:(A) $10,000; and(B) the high needs and rural factor, as determined under Subsection (c), multiplied by $2,000;(2) for each teacher candidate completing preservice practice hours at the district under Section 21.904, the sum of:(A) $24,000; and(B) the high needs and rural factor, as determined under Subsection (c), multiplied by $3,000;(3) for each teacher candidate completing preservice practice hours at the district under Section 21.905, the sum of:(A) $10,000; and(B) the high needs and rural factor, as determined under Subsection (c), multiplied by $2,000;(4) for each district employee participating in a partnership described by Section 21.906(b)(2), the sum of:(A) $8,000; and(B) the high needs and rural factor, as determined under Subsection (c), multiplied by $1,000; and(5) for each classroom teacher being mentored under the preparing and retaining educators through partnership mentorship program established under Section 21.907, $3,000.(c) The high needs and rural factor is the lesser of:(1) the average of the point value assigned to each student at a district campus under Sections 48.112(e) and (f); or(2) 4.0.(d) In addition to the funding under Subsection (b), a district is entitled to an additional $2,000 for each teacher candidate described by Subsection (b)(1), (2), or (3) who is a candidate for certification in bilingual education or special education.(e) The Texas School for the Deaf and the Texas School for the Blind and Visually Impaired are entitled to an allotment under this section. If the commissioner determines that assigning point values under Subsection (c) to students enrolled in the Texas School for the Deaf or the Texas School for the Blind and Visually Impaired is impractical, the commissioner may use the average point value assigned for those students' home districts for purposes of calculating the high needs and rural factor.(f) Unless a greater number of individuals is provided for by appropriation for that school year, a school district may receive an allotment for a school year for not more than:(1) except as provided by Subsection (g), 40 individuals under each of Subsections (b)(2), (4), and (5); and(2) a total of 80 individuals under Subsections (b)(1) and (3).(g) If more than 40 individuals are eligible to receive an allotment under Subsection (b)(2) for a school district, the district is entitled to an allotment under Subsection (b)(1) for those individuals, subject to the limitation under Subsection (f)(2).(h) For purposes of offsetting tuition, fees, and administrative costs, using money to which a school district is otherwise entitled under Subsection (b), the commissioner shall provide to a teacher candidate's educator preparation program each of the following applicable amounts and reduce the district's allotment under that subsection accordingly:(1) $5,000 for each teacher candidate who completed a partnership preservice program under Section 21.903 who obtains a standard certificate and has completed one year of employment with the district;(2) $10,000 for each teacher candidate who completed a partnership preservice program under Section 21.904 who obtains an enhanced standard certificate and has completed one year of employment with the district; and(3) $2,500 for each teacher candidate participating in the alternative partnership preservice program under Section 21.905 who holds an intern with preservice experience certificate, and an additional $2,500 for each teacher candidate who completes the alternative partnership preservice program and obtains a standard certificate under Section 21.0412.(i) An institution of higher education that operates an educator preparation program that receives money under Subsection (h) must spend not less than 85 percent of the money received on the educator preparation program for which the money was received.(j) The agency shall only provide:(1) an initial payment of $4,000 of the money the school district is entitled to receive under Subsection (b)(1) for a teacher candidate until the teacher candidate successfully completes the requirements of a partnership preservice program under Section 21.903 by the deadline established by the agency;(2) an initial payment of $12,000 of the money the school district is entitled to receive under Subsection (b)(2) for a teacher candidate until the teacher candidate successfully completes the requirements of a partnership preservice program under Section 21.904 by the deadline established by the agency;(3) an initial payment of $4,000 of the money the school district is entitled to receive under Subsection (b)(3) for a teacher candidate until the teacher candidate successfully completes the requirements of an alternative partnership preservice program under Section 21.905 by the deadline established by the agency and issuance of an intern with preservice experience certificate; and(4) 50 percent of the money the school district is entitled to receive under Subsection (b)(4) for a district employee on the employee's successful completion of a bachelor's degree by the deadline established by the agency. Added by Acts 2025, 89th Leg., R.S., Ch. 1065 (H.B. 2), Sec. 2.18, eff. September 1, 2026.",https://statutes.capitol.texas.gov/Docs/ED/htm/ED.48.htm?view=all#48.157.
Sec. 48.158.,TEACHER RETENTION ALLOTMENT,"(a) In this section, ""classroom teacher"" has the meaning assigned by Section 5.001, except that the term also includes:(1) a person who is not required to hold a certificate issued under Subchapter B, Chapter 21, who otherwise meets the definition of a classroom teacher under Section 5.001; and(2) a person, including a person described by Subdivision (1), employed by an entity with which a school district has entered into a contract who otherwise meets the definition of a classroom teacher under Section 5.001.(b) A school district is entitled to an annual allotment for each classroom teacher who is employed by or contracts with the district for which the allotment is provided as follows:(1) if the district has 5,000 or fewer students enrolled for the school year:(A) $4,000 for each classroom teacher who has at least three but less than five years of teaching experience; and(B) $8,000 for each classroom teacher who has five or more years of teaching experience; and(2) if the district has more than 5,000 students enrolled for the school year:(A) $2,500 for each classroom teacher who has at least three but less than five years of teaching experience; and(B) $5,000 for each classroom teacher who has five or more years of teaching experience.(b-1) Instead of the allotment under Subsection (b)(2), a school district described by that subdivision is entitled to funding under Subsection (b)(1) if the school district received an allotment under Subsection (b)(1) in a previous school year.(c) For the 2025-2026 school year, a school district shall use money received under Subsection (b) to:(1) increase the salary provided to each classroom teacher for which the district is entitled to funding under Subsection (b) for that year over the salary the teacher received or would have received if the teacher was employed by or contracted with the district in the 2024-2025 school year by at least the amount received per classroom teacher under Subsection (b); or(2) if the school district is applying to be designated as an enhanced teacher incentive allotment system, increase the salaries of classroom teachers for that year based on performance.(d) Except as provided by Subsection (e), for the 2026-2027 and each subsequent school year, a school district shall use money received under Subsection (b) to maintain the salary increases for classroom teachers provided under Subsection (c). Any additional funding generated for a school district under this section may only be used for the compensation of classroom teachers who are employed by or contract with the district and who have three or more years of experience.(e) A school district that has been designated as an enhanced teacher incentive allotment system for the applicable school year may use money received under Subsection (b) to provide salaries to classroom teachers in accordance with the district's compensation plan.(f) A school district that increases classroom teacher compensation in the 2025-2026 school year to comply with Subsection (c), as added by H.B. 2, 89th Legislature, Regular Session, 2025, is providing compensation for services rendered independently of an existing employment contract applicable to that school year and is not in violation of Section 53, Article III, Texas Constitution. This subsection expires September 1, 2027. Added by Acts 2025, 89th Leg., R.S., Ch. 1065 (H.B. 2), Sec. 1.07, eff. September 1, 2025.",https://statutes.capitol.texas.gov/Docs/ED/htm/ED.48.htm?view=all#48.158.
Sec. 48.1581.,SUPPORT STAFF RETENTION ALLOTMENT,"(a) In this section, ""non-administrative staff"":(1) includes a full-time or part-time employee who is not eligible for a salary increase under Section 48.158, including:(A) a teacher not eligible for a salary increase under Section 48.158;(B) a school counselor;(C) a librarian;(D) a school nurse;(E) a teacher's assistant;(F) a member of the custodial staff;(G) a member of the food services staff;(H) a bus driver; (I) an administrative assistant; and(J) other support staff; and(2) does not include:(A) a superintendent of a school district or other administrator serving as educational leader and chief executive officer;(B) an assistant superintendent or a person in an equivalent role;(C) a principal or assistant principal; and(D) an employee in a centralized supervisory role.(b) For purposes of this section, a school district's adjusted average attendance is the quotient of:(1) the sum of the district's allotments under Subchapter B and, if applicable, the allotment under Section 48.101 for the applicable school year; and(2) the basic allotment for the applicable school year.(b-1) In determining adjusted average daily attendance under this section, the agency shall exclude students who do not reside in the district and are enrolled in a full-time virtual program.(c) A school district is entitled to an annual allotment of $45 for each student in adjusted average attendance.(d) For the 2025-2026 school year, a school district shall use money received under Subsection (c) to increase the salaries provided to non-administrative staff.(e) For the 2026-2027 and each subsequent school year, a school district shall use money received under Subsection (c) to maintain the salary increases provided under Subsection (d). Any additional money the district receives under this section may only be used for the compensation of non-administrative staff.(f) A school district that increases non-administrative staff compensation in the 2025-2026 school year to comply with Subsection (d), as added by H.B. 2, Acts of the 89th Legislature, Regular Session, 2025, is providing compensation for services rendered independently of an existing employment contract applicable to that school year and is not in violation of Section 53, Article III, Texas Constitution. This subsection expires September 1, 2027. Added by Acts 2025, 89th Leg., R.S., Ch. 1065 (H.B. 2), Sec. 1.07, eff. September 1, 2025.",https://statutes.capitol.texas.gov/Docs/ED/htm/ED.48.htm?view=all#48.1581.
Sec. 48.159.,SPECIAL EDUCATION FULL INDIVIDUAL AND INITIAL EVALUATION,"For each child for whom a school district conducts a full individual and initial evaluation under Section 29.004 or 20 U.S.C. Section 1414(a)(1), the district is entitled to an allotment of $1,000 or a greater amount provided by appropriation. Added by Acts 2025, 89th Leg., R.S., Ch. 1065 (H.B. 2), Sec. 4.59, eff. September 1, 2025.Added by Acts 2025, 89th Leg., R.S., Ch. 1137 (S.B. 568), Sec. 60, eff. September 1, 2025.",https://statutes.capitol.texas.gov/Docs/ED/htm/ED.48.htm?view=all#48.159.
Sec. 48.160.,SCHOOL SAFETY ALLOTMENT,"(a) Except as provided by Subsection (a-1), a school district is entitled to an annual allotment equal to the sum of the following amounts or a greater amount provided by appropriation:(1) $20 for each student in average daily attendance, plus $1 for each student in average daily attendance per every $50 by which the district's maximum basic allotment under Section 48.051 exceeds $6,160, prorated as necessary; and(2) $33,540 per campus.(a-1) A school district campus that provides only virtual instruction or utilizes only facilities not subject to the district's control is not included for purposes of determining a school district's allotment under Subsection (a).(b) Funds allocated under this section must be used to improve school safety and security, including costs associated with:(1) securing school facilities in accordance with the requirements of Section 37.351, including:(A) improvements to school infrastructure;(B) the use or installation of perimeter security fencing conducive to a public school learning environment or physical barriers, which may not include razor wire;(C) interior and exterior door and window safety and security upgrades, including:(i) exterior door numbering;(ii) primary and secondary locking systems; and(iii) security film that provides resistance to a forced entry; and(D) the purchase and maintenance of:(i) security cameras and, if the district has already installed security cameras, other security equipment, including video surveillance as provided by Section 29.022; and(ii) technology, including communications systems or devices, such as silent panic alert devices, two-way radios, or wireless Internet booster equipment, that facilitates communication and information sharing between students, school personnel, and first responders in an emergency;(2) providing security for the district, including:(A) employing school district peace officers, private security officers, and school marshals; and(B) collaborating with local law enforcement agencies, such as entering into a memorandum of understanding for the assignment of school resource officers to schools in the district;(3) school safety and security measures, including:(A) active shooter and emergency response training;(B) prevention and treatment programs relating to addressing adverse childhood experiences; and(C) the prevention, identification, and management of emergencies and threats, using evidence-based, effective prevention practices and including:(i) providing licensed counselors, social workers, behavioral interventionists, chaplains, and individuals trained in restorative discipline and justice or other discipline management practices;(ii) providing mental health personnel and support, including chaplains;(iii) providing behavioral health services, including services provided by chaplains;(iv) establishing threat reporting systems; and(v) developing and implementing programs focused on restorative justice practices, culturally relevant instruction, and providing mental health support, including support provided by chaplains;(4) providing programs related to suicide prevention, intervention, and postvention, including programs provided by chaplains; and(5) employing a school safety director and other personnel to manage and monitor school safety initiatives and the implementation of school safety requirements for the district.(b-1) The agency may designate certain technologies that a school district, in using funds allocated under this section, may purchase only from a vendor approved by the agency.(b-2) If the agency, in coordination with the Texas School Safety Center, determines that entering into a statewide contract with a vendor for the provision of a technology designated under Subsection (b-1) would result in cost savings to school districts, the agency may, after receiving approval from the Legislative Budget Board and office of the governor, enter into a contract with a vendor to provide the technology to each district that uses funds allocated under this section to purchase that technology.(c) A school district may use funds allocated under this section for equipment or software that is used for a school safety and security purpose and an instructional purpose, provided that the instructional use does not compromise the safety and security purpose of the equipment or software.(c-1) The agency, or if designated by the agency, the Texas School Safety Center, shall establish and publish a directory of approved vendors of school safety technology and equipment a school district may select from when using funds allocated under this section. If a school district uses funds allocated under this section to purchase technology or equipment from a vendor that is not included in the directory, the district must solicit bids from at least three vendors before completing the purchase.(d) The commissioner shall annually publish a report regarding funds allocated under this section including the programs, personnel, and resources purchased by districts using funds under this section and other purposes for which the funds were used.(e) Notwithstanding any other law, a school district may use funds allocated under this section to provide training to a person authorized by the district to carry a firearm on a district campus. Added by Acts 2019, 86th Leg., R.S., Ch. 464 (S.B. 11), Sec. 20, eff. June 6, 2019.Transferred, redesignated and amended by Acts 2021, 87th Leg., R.S., Ch. 806 (H.B. 1525), Sec. 31, eff. September 1, 2021.Amended by: Acts 2023, 88th Leg., R.S., Ch. 896 (H.B. 3), Sec. 23, eff. September 1, 2023.Acts 2023, 88th Leg., R.S., Ch. 1142 (S.B. 763), Sec. 2, eff. September 1, 2023.Transferred, redesignated and amended from Education Code, Section 48.115 by Acts 2025, 89th Leg., R.S., Ch. 1065 (H.B. 2), Sec. 7.15, eff. September 1, 2025.Amended by: Acts 2025, 89th Leg., R.S., Ch. 1070 (H.B. 121), Sec. 12, eff. September 1, 2025.Acts 2025, 89th Leg., R.S., Ch. 1129 (S.B. 260), Sec. 1, eff. September 1, 2025.",https://statutes.capitol.texas.gov/Docs/ED/htm/ED.48.htm?view=all#48.160.
Sec. 48.161.,ALLOTMENT FOR BASIC COSTS,"(a) A school district is entitled to an annual allotment of $106 for each student enrolled in the district.(b) Money allocated under this section may be used only to pay costs associated with:(1) transportation;(2) hiring retired teachers;(3) providing health insurance and employee benefits and paying for payroll taxes;(4) contributions and other costs under Subchapter E, Chapter 825, Government Code;(5) utilities; and(6) property and casualty insurance. Added by Acts 2025, 89th Leg., R.S., Ch. 1065 (H.B. 2), Sec. 7.16, eff. September 1, 2025. SUBCHAPTER E. TIER TWO ENTITLEMENT",https://statutes.capitol.texas.gov/Docs/ED/htm/ED.48.htm?view=all#48.161.
Sec. 48.201.,PURPOSE,"The purpose of the tier two component of the Foundation School Program is to provide each school district with the opportunity to provide the basic program and to supplement that program at a level of its own choice. An allotment under this subchapter may be used for any legal purpose other than:(1) capital outlay or debt service; or(2) a purpose prohibited by Section 45.105(c-1) or another provision of this code. Added by Acts 1995, 74th Leg., ch. 260, Sec. 1, eff. May 30, 1995. Amended by Acts 1999, 76th Leg., ch. 396, Sec. 1.20, eff. Sept. 1, 1999.Transferred, redesignated and amended from Education Code, Section 42.301 by Acts 2019, 86th Leg., R.S., Ch. 943 (H.B. 3), Sec. 1.038, eff. September 1, 2019.Amended by: Acts 2021, 87th Leg., R.S., Ch. 1046 (S.B. 1365), Sec. 3.03, eff. September 1, 2021.",https://statutes.capitol.texas.gov/Docs/ED/htm/ED.48.htm?view=all#48.201.
