section,title,text,url
Sec. 48.261.,REIMBURSEMENT FOR DISASTER REMEDIATION COSTS,"(a) This section applies only to a school district all or part of which is located in an area declared a disaster area by the governor under Chapter 418, Government Code, and that incurs disaster remediation costs as a result of the disaster.(b) During the two-year period following the date of the governor's initial proclamation or executive order declaring a state of disaster, a district may apply to the commissioner for reimbursement of disaster remediation costs that the district pays during that period and does not anticipate recovering through insurance proceeds, federal disaster relief payments, or another similar source of reimbursement.(c) The commissioner may provide reimbursement under this section only if funds are available for that purpose from:(1) amounts appropriated for that purpose, including amounts appropriated for school districts for that purpose to the disaster contingency fund established under Section 418.073, Government Code; or(2) Foundation School Program funds available for that purpose, based on a determination by the commissioner that the amount appropriated for the Foundation School Program, including the facilities component as provided by Chapter 46, exceeds the amount to which districts are entitled under this chapter and Chapter 46.(d) A district seeking reimbursement under this section must provide the commissioner with adequate documentation of the costs for which the district seeks reimbursement.(e) The commissioner shall adopt rules necessary to implement this section, including rules:(1) defining ""disaster remediation costs"" for purposes of this section, which must include the cost to repair or replace vehicles or computers damaged in the disaster; and(2) specifying the type of documentation required under Subsection (d).(f) Notwithstanding any other provision of this section, the commissioner may permit a district to use amounts provided to a district under this section to pay the costs of replacing a facility instead of repairing the facility. The commissioner shall ensure that a district that elects to replace a facility does not receive an amount under this section that exceeds the lesser of:(1) the amount that would be provided to the district if the facility were repaired; or(2) the amount necessary to replace the facility.(g) This section does not require the commissioner to provide any requested reimbursement. A decision of the commissioner regarding reimbursement is final and may not be appealed. Added by Acts 2009, 81st Leg., R.S., Ch. 1006 (H.B. 4102), Sec. 5, eff. June 19, 2009.Amended by: Acts 2011, 82nd Leg., 1st C.S., Ch. 4 (S.B. 1), Sec. 57.32(a)(5), eff. September 1, 2017.Transferred, redesignated and amended from Education Code, Section 42.2524 by Acts 2019, 86th Leg., R.S., Ch. 943 (H.B. 3), Sec. 1.042, eff. September 1, 2019.",https://statutes.capitol.texas.gov/Docs/ED/htm/ED.48.htm?view=all#48.261.
Sec. 48.262.,ADJUSTMENTS FOR CERTAIN DISTRICTS RECEIVING FEDERAL IMPACT AID,"The commissioner is granted the authority to ensure that school districts receiving federal impact aid due to the presence of a military installation or significant concentrations of military students do not receive more than an eight percent reduction should the federal government reduce appropriations to those schools. Added by Acts 2011, 82nd Leg., 1st C.S., Ch. 4 (S.B. 1), Sec. 57.21, eff. September 28, 2011.Transferred, redesignated and amended from Education Code, Section 42.2525 by Acts 2019, 86th Leg., R.S., Ch. 943 (H.B. 3), Sec. 1.042, eff. September 1, 2019.",https://statutes.capitol.texas.gov/Docs/ED/htm/ED.48.htm?view=all#48.262.
Sec. 48.2642.,ADJUSTMENTS FOR TEXAS FIRST EARLY HIGH SCHOOL COMPLETION PROGRAM GRADUATES,"(a) Notwithstanding any other provision of this chapter, the commissioner shall count toward a school district's or open-enrollment charter school's average daily attendance under Section 48.005 each student who graduates early from high school in the district or school under the Texas First Early High School Completion Program established under Section 28.0253 for the period in which the student is enrolled at an eligible institution using state credit awarded under the Texas First Scholarship Program established under Subchapter K-1, Chapter 56, based on a 100 percent attendance rate.(b) As soon as practicable after receipt of the report under Section 56.226, the commissioner shall reduce the amount of a school district's or open-enrollment charter school's entitlement under this chapter for the school year by an amount equal to the total amount of state credit issued during the preceding school year to the district's or school's high school graduates under the Texas First Scholarship Program established under Subchapter K-1, Chapter 56. Added by Acts 2021, 87th Leg., R.S., Ch. 962 (S.B. 1888), Sec. 2, eff. June 18, 2021.",https://statutes.capitol.texas.gov/Docs/ED/htm/ED.48.htm?view=all#48.2642.
Sec. 48.265.,EXCESS FUNDS FOR VIDEO SURVEILLANCE OF SPECIAL EDUCATION SETTINGS,"(a) If the commissioner determines that the amount appropriated for the purposes of the Foundation School Program exceeds the amount to which school districts are entitled under this chapter, the commissioner may provide grants using the excess money for the purchase of video equipment, or for the reimbursement of costs for previously purchased video equipment, used for monitoring special education classrooms or other special education settings required under Section 29.022.(b) In awarding grants under this section, the commissioner shall give highest priority to districts with maintenance and operations tax rates at the greatest rates permitted by law. The commissioner shall also give priority to:(1) districts with maintenance and operations tax rates at least equal to the state maximum compressed tax rate, as defined by Section 48.051(a), and lowest amounts of maintenance and operations tax revenue per weighted student; and(2) districts with debt service tax rates near or equal to the greatest rates permitted by law.(c) The commissioner may adopt rules to implement and administer this section. Added by Acts 2015, 84th Leg., R.S., Ch. 1147 (S.B. 507), Sec. 3, eff. June 19, 2015.Transferred, redesignated and amended from Education Code, Section 42.2528 by Acts 2019, 86th Leg., R.S., Ch. 943 (H.B. 3), Sec. 1.042, eff. September 1, 2019.Amended by: Acts 2025, 89th Leg., R.S., Ch. 1065 (H.B. 2), Sec. 4.60, eff. September 1, 2025.Acts 2025, 89th Leg., R.S., Ch. 1137 (S.B. 568), Sec. 61, eff. September 1, 2025.",https://statutes.capitol.texas.gov/Docs/ED/htm/ED.48.htm?view=all#48.265.
Sec. 48.266.,DISTRIBUTION OF FOUNDATION SCHOOL FUND,"(a) For each school year the commissioner shall determine:(1) the amount of money to which a school district is entitled under Subchapters B, C, and D;(2) the amount of money to which a school district is entitled under Subchapter E;(3) the amount of money allocated to the district from the available school fund;(4) the amount of each district's tier one local share under Section 48.256; and(5) the amount of each district's tier two local share under Section 48.202 for:(A) the district's maintenance and operations tax effort described by Section 48.202(a-1)(1); and(B) the district's maintenance and operations tax effort described by Section 48.202(a-1)(2).(b) Except as provided by this subsection and subject to Subsection (b-1), the commissioner shall base the determinations under Subsection (a) on the estimates provided to the legislature under Section 48.269, or, if the General Appropriations Act provides estimates for that purpose, on the estimates provided under that Act, for each school district for each school year. The commissioner shall reduce the entitlement of each district that has a final taxable value of property for the second year of a state fiscal biennium that is higher than the estimate under Section 48.269 or the General Appropriations Act, as applicable. A reduction under this subsection may not reduce the district's entitlement below the amount to which it is entitled at its actual taxable value of property.(b-1) Periodically throughout the school year, the commissioner shall adjust the determinations made under Subsection (a) to reflect current school year estimates of a district's enrollment and average daily attendance, based on attendance reporting for each six-week interval.(c) Each school district is entitled to an amount equal to the difference for that district between the sum of Subsections (a)(1) and (a)(2) and the sum of Subsections (a)(3), (a)(4), and (a)(5).(d) The commissioner shall approve warrants to each school district equaling the amount of its entitlement except as provided by this section. Warrants for all money expended according to this chapter shall be approved and transmitted to treasurers or depositories of school districts in the same manner that warrants for state payments are transmitted. The total amount of the warrants issued under this section may not exceed the total amount appropriated for Foundation School Program purposes for that fiscal year.(e) If a school district demonstrates to the satisfaction of the commissioner that the estimate of the district's tax rate, student enrollment, or taxable value of property used in determining the amount of state funds to which the district is entitled are so inaccurate as to result in undue financial hardship to the district, the commissioner may adjust funding to that district in that school year to the extent that funds are available for that year.(f) If the amount appropriated for the Foundation School Program for the second year of a state fiscal biennium is less than the amount to which school districts and open-enrollment charter schools are entitled for that year, the commissioner shall certify the amount of the difference to the Legislative Budget Board not later than January 1 of the second year of the state fiscal biennium. The Legislative Budget Board shall propose to the legislature that the certified amount be transferred to the foundation school fund from the economic stabilization fund and appropriated for the purpose of increases in allocations under this subsection. If the legislature fails during the regular session to enact the proposed transfer and appropriation and there are not funds available under Subsection (h), the commissioner shall adjust the total amounts due to each school district and open-enrollment charter school under this chapter and the total amounts necessary for each school district to comply with the requirements of Chapter 49 by an amount determined by applying to each district and school the same percentage adjustment to the total amount of state and local revenue due to the district or school under this chapter and Chapter 49 so that the total amount of the adjustment to all districts and schools results in an amount equal to the total adjustment necessary. The following fiscal year:(1) a district's or school's entitlement under this section is increased by an amount equal to the adjustment made under this subsection; and(2) the amount necessary for a district to comply with the requirements of Chapter 49 is reduced by an amount necessary to ensure a district's full recovery of the adjustment made under this subsection.(g) Not later than March 1 each year, the commissioner shall determine the actual amount of state funds to which each school district is entitled under the allocation formulas in this chapter for the current school year and shall compare that amount with the amount of the warrants issued to each district for that year. If the amount of the warrants differs from the amount to which a district is entitled because of variations in the district's tax rate, student enrollment, or taxable value of property, the commissioner shall adjust the district's entitlement for the next fiscal year accordingly.(h) The legislature may appropriate funds necessary for increases under Subsection (g) from funds that the comptroller, at any time during the fiscal year, finds are available.(i) The commissioner shall compute for each school district the total amount by which the district's allocation of state funds is increased or reduced under Subsection (g) and shall certify that amount to the district. Added by Acts 1995, 74th Leg., ch. 260, Sec. 1, eff. May 30, 1995. Amended by Acts 1997, 75th Leg., ch. 1071, Sec. 19, eff. Sept. 1, 1997; Acts 1999, 76th Leg., ch. 396, Sec. 1.19, eff. Sept. 1, 1999; Acts 2001, 77th Leg., ch. 1187, Sec. 2.06, eff. Sept. 1, 2001; Acts 2003, 78th Leg., ch. 201, Sec. 34, eff. Sept. 1, 2003.Amended by: Acts 2006, 79th Leg., 3rd C.S., Ch. 5 (H.B. 1), Sec. 1.05, eff. May 31, 2006.Acts 2006, 79th Leg., 3rd C.S., Ch. 5 (H.B. 1), Sec. 1.20, eff. May 31, 2006.Acts 2009, 81st Leg., R.S., Ch. 1328 (H.B. 3646), Sec. 60, eff. September 1, 2009.Acts 2011, 82nd Leg., 1st C.S., Ch. 4 (S.B. 1), Sec. 57.22, eff. September 28, 2011.Acts 2011, 82nd Leg., 1st C.S., Ch. 4 (S.B. 1), Sec. 57.23, eff. September 1, 2017.Acts 2011, 82nd Leg., 1st C.S., Ch. 4 (S.B. 1), Sec. 57.32(a)(6), eff. September 1, 2017.Transferred, redesignated and amended from Education Code, Section 42.253 by Acts 2019, 86th Leg., R.S., Ch. 943 (H.B. 3), Sec. 1.042, eff. September 1, 2019.Amended by: Acts 2025, 89th Leg., R.S., Ch. 1065 (H.B. 2), Sec. 7.19, eff. September 1, 2025.",https://statutes.capitol.texas.gov/Docs/ED/htm/ED.48.htm?view=all#48.266.
Sec. 48.267.,ADJUSTMENT BY COMMISSIONER,"(a) The commissioner may make adjustments to amounts due to a school district under this chapter or Chapter 46, or to amounts necessary for a district to comply with the requirements of Chapter 49, as provided by this section.(b) A school district that has a major taxpayer, as determined by the commissioner, that because of a protest of the valuation of the taxpayer's property fails to pay all or a portion of the ad valorem taxes due to the district may apply to the commissioner to have the district's taxable value of property or ad valorem tax collections adjusted for purposes of this chapter or Chapter 46 or 49. The commissioner may make the adjustment only to the extent the commissioner determines that making the adjustment will not:(1) in the fiscal year in which the adjustment is made, cause the amount to which school districts are entitled under this chapter to exceed the amount appropriated for purposes of the Foundation School Program for that year; and(2) if the adjustment is made in the first year of a state fiscal biennium, cause the amount to which school districts are entitled under this chapter for the second year of the biennium to exceed the amount appropriated for purposes of the Foundation School Program for that year.(c) The commissioner shall recover the benefit of any adjustment made under this section by making offsetting adjustments in the school district's taxable value of property or ad valorem tax collections for purposes of this chapter or Chapter 46 or 49 on a final determination of the taxable value of property that was the basis of the original adjustment, or in the second school year following the year in which the adjustment is made, whichever is earlier.(d) This section does not require the commissioner to make any requested adjustment. A determination by the commissioner under this section is final and may not be appealed. Added by Acts 2001, 77th Leg., ch. 1156, Sec. 5, eff. Sept. 1, 2001.Transferred, redesignated and amended from Education Code, Section 42.2531 by Acts 2019, 86th Leg., R.S., Ch. 943 (H.B. 3), Sec. 1.042, eff. September 1, 2019.",https://statutes.capitol.texas.gov/Docs/ED/htm/ED.48.htm?view=all#48.267.
Sec. 48.268.,ADJUSTMENT FOR RESOLUTION OF DISPUTE OR ERROR RESULTING IN TAXATION OF SAME PROPERTY BY MULTIPLE SCHOOL DISTRICTS,"The commissioner shall adjust the amounts due to a school district under this chapter and Chapter 46 as necessary to account for the resolution of a dispute or error involving the district and another district by an agreement between the districts entered into under Section 31.112(c), Tax Code, or by a final order of the supreme court entered under Section 72.010, Local Government Code. Added by Acts 2017, 85th Leg., R.S., Ch. 768 (S.B. 2242), Sec. 5, eff. June 12, 2017.Transferred, redesignated and amended from Education Code, Section 42.2532 by Acts 2019, 86th Leg., R.S., Ch. 943 (H.B. 3), Sec. 1.042, eff. September 1, 2019.",https://statutes.capitol.texas.gov/Docs/ED/htm/ED.48.htm?view=all#48.268.
Sec. 48.269.,ESTIMATES REQUIRED,"(a) Not later than October 1 of each even-numbered year:(1) the agency shall submit to the legislature an estimate of the tax rate and student enrollment of each school district for the following biennium; and(2) the comptroller shall submit to the legislature an estimate of the total taxable value of all property in the state as determined under Subchapter M, Chapter 403, Government Code, for the following biennium.(b) The agency and the comptroller shall update the information provided to the legislature under Subsection (a) not later than March 1 of each odd-numbered year. Added by Acts 1995, 74th Leg., ch. 260, Sec. 1, eff. May 30, 1995. Amended by Acts 1997, 75th Leg., ch. 1071, Sec. 20, eff. Sept. 1, 1997.Transferred, redesignated and amended from Education Code, Section 42.254 by Acts 2019, 86th Leg., R.S., Ch. 943 (H.B. 3), Sec. 1.042, eff. September 1, 2019.",https://statutes.capitol.texas.gov/Docs/ED/htm/ED.48.htm?view=all#48.269.
Sec. 48.270.,FALSIFICATION OF RECORDS;  REPORT,"When, in the opinion of the agency's director of school audits, audits or reviews of accounting, enrollment, or other records of a school district reveal deliberate falsification of the records, or violation of the provisions of this chapter, through which the district's share of state funds allocated under the authority of this chapter would be, or has been, illegally increased, the director shall promptly and fully report the fact to the State Board of Education, the state auditor, and the appropriate county attorney, district attorney, or criminal district attorney. Added by Acts 1995, 74th Leg., ch. 260, Sec. 1, eff. May 30, 1995.Transferred, redesignated and amended from Education Code, Section 42.255 by Acts 2019, 86th Leg., R.S., Ch. 943 (H.B. 3), Sec. 1.042, eff. September 1, 2019.",https://statutes.capitol.texas.gov/Docs/ED/htm/ED.48.htm?view=all#48.270.
Sec. 48.271.,EFFECT OF APPRAISAL APPEAL,"(a) If the final determination of an appeal under Chapter 42, Tax Code, results in a reduction in the taxable value of property that exceeds five percent of the total taxable value of property in the school district for the same tax year determined under Subchapter M, Chapter 403, Government Code, the commissioner shall request the comptroller to adjust its taxable property value findings for that year consistent with the final determination of the appraisal appeal.(b) If the district would have received a greater amount from the foundation school fund for the applicable school year using the adjusted value, the commissioner shall add the difference to subsequent distributions to the district from the foundation school fund. An adjustment does not affect the local fund assignment of any other district. Added by Acts 1995, 74th Leg., ch. 260, Sec. 1, eff. May 30, 1995.Transferred, redesignated and amended from Education Code, Section 42.257 by Acts 2019, 86th Leg., R.S., Ch. 943 (H.B. 3), Sec. 1.042, eff. September 1, 2019.",https://statutes.capitol.texas.gov/Docs/ED/htm/ED.48.htm?view=all#48.271.
Sec. 48.272.,RECOVERY OF OVERALLOCATED FUNDS,"(a) If a school district has received an overallocation of state funds, the agency shall, by withholding from subsequent allocations of state funds for the current or subsequent school year or by requesting and obtaining a refund, recover from the district an amount equal to the overallocation.(b) Notwithstanding Subsection (a), the agency may recover an overallocation of state funds over a period not to exceed the subsequent five school years if the commissioner determines that the overallocation was the result of exceptional circumstances reasonably caused by statutory changes to Chapter 46 or 49 or this chapter and related reporting requirements.(c) If a district fails to comply with a request for a refund under Subsection (a), the agency shall certify to the comptroller that the amount constitutes a debt for purposes of Section 403.055, Government Code. The agency shall provide to the comptroller the amount of the overallocation and any other information required by the comptroller. The comptroller may certify the amount of the debt to the attorney general for collection.(d) Any amounts recovered under this section shall be deposited in the foundation school fund.(e) Subject to Subsection (f), the agency may review a school district as necessary to determine if the district qualifies for each allotment received by the district under this chapter. If the agency determines that a school district received an allotment to which the district was not entitled, the agency may establish a corrective action plan or withhold the applicable amount of funding from the district.(f) The agency may not review school district expenditures that occurred seven or more years before the review. Added by Acts 1995, 74th Leg., ch. 260, Sec. 1, eff. May 30, 1995.Amended by: Acts 2011, 82nd Leg., 1st C.S., Ch. 4 (S.B. 1), Sec. 57.24, eff. September 28, 2011.Transferred, redesignated and amended from Education Code, Section 42.258 by Acts 2019, 86th Leg., R.S., Ch. 943 (H.B. 3), Sec. 1.042, eff. September 1, 2019.",https://statutes.capitol.texas.gov/Docs/ED/htm/ED.48.htm?view=all#48.272.
Sec. 48.2721.,RECOVERY OF FUNDS FROM EXCESSIVE TAXATION,"The commissioner shall reduce state aid or adjust the limit on local revenue under Section 48.257 in an amount equal to the amount of revenue generated by a school district's tax effort that is not in compliance with Section 45.003 or this chapter. Added by Acts 2021, 87th Leg., R.S., Ch. 806 (H.B. 1525), Sec. 37, eff. September 1, 2021.",https://statutes.capitol.texas.gov/Docs/ED/htm/ED.48.htm?view=all#48.2721.
